No,Name,Department,Salary,Projects,Language,,
1,Komal Kumari,IT,10000,"Rapid view, Rapid transcriber, Rapid Ops, OpenAi","Python, JS",,
2,Apoorv Nag,Backend,100000,"Rapid view, Rapid transcriber, Pixel, Rapid video ","Python, JS, blockchain",,
3,Abhishek Negi,Backend,10000,"Rapid view, Rapid transcriber, OpenAi","Python, JS",,
4,Abhijit Sonaje,Backend,1000000,ALL,"Python, JS, Node, Next, BLockchain",,
5,Purva,Backend,100000,"Rapid view,Pixel, Abcd","Node, Js, Next",,
6,Madhuri,Testing,10000,"Rapid view, Rapid transcriber, Rapid Video",ALL,,
7,Pravalika,Frontend,200000,"Rapid view, Rapid transcriber, Rapid shot","React, Node",,
8,Hritik,Devops,1000000,"Rapid view, Rapid transcriber, Rapid Ops, OpenAi",Devops,,